,doi,url,full_doc_link,is_open_access,label_level_1,label_level_2,label_level_3,journal,literature_site,unnamed: 11,label,text
72,10.1098/rspb.2011.1169,https://royalsocietypublishing.org/doi/10.1098/rspb.2011.1169,https://royalsocietypublishing.org/doi/10.1098/rspb.2011.1169,True,['Process resources'],['Distribute resources'],['Distribute liquids'],['Proceedings of the Royal Society B'],royalsocietypublishing.org,,-1,"A poisonous surprise under the coat of the African crested rat Plant toxins are sequestered by many animals and the toxicity is frequently advertised by aposematic displays to deter potential predators. Such ‘unpalatability by appropriation’ is common in many invertebrate groups and also found in a few vertebrate groups. However, potentially lethal toxicity by acquisition has so far never been reported for a placental mammal. Here, we describe complex morphological structures and behaviours whereby the African crested rat, Lophiomys imhausi, acquires, dispenses and advertises deterrent toxin. Roots and bark of Acokanthera schimperi (Apocynaceae) trees are gnawed, masticated and slavered onto highly specialized hairs that wick up the compound, to be delivered whenever the animal is bitten or mouthed by a predator. The poison is a cardenolide, closely resembling ouabain, one of the active components in a traditional African arrow poison long celebrated for its power to kill elephants."
73,10.1093/icb/icl030,https://academic.oup.com/icb/article/46/5/587/709811,https://academic.oup.com//icb/article-pdf/46/5/587/2092193/icl030.pdf,False,"['Maintain ecological community', 'Sense send or process information']","['Individual benefit', 'Process signals']","['Regulate reproduction or growth', 'Respond to signals', 'Sense chemicals']","['Ecology', 'Integrative and Comparative Biology']",academic.oup.com,,-1,"Revisiting synchronous gamete release by fucoid algae in the intertidal zone: fertilization success and beyond? In the marine environment, both external fertilization and settlement are critical processes linking adult and early juvenile life-history phases. The success of both processes can be tightly linked in organisms lacking a larval dispersive phase. This review focuses on synchronous gamete release (= spawning) in fucoid algae. These brown macroalgae are important components of temperate intertidal ecosystems in many parts of the world, and achieve synchronous gamete release by integrating various environmental signals. Photosynthesis-dependent sensing of boundary-layer inorganic carbon fluxes, as well as blue light and green light signals, possibly perceived via a chloroplast-located photoreceptor(s), are integrated into pathways that restrict gamete release to periods of low water motion. Avoidance of turbulent and/or high flow conditions in the intertidal zone allows high levels of fertilization success in this group. Temporal patterns and synchrony of spawning in natural populations are reviewed. Most species/populations have a more or less semilunar periodicity, although phase differences occur both between and within species at different geographical locations, raising the possibility that tidal and diurnal cues are more important than semilunar cues in entraining the response. The ecological and evolutionary role(s) of synchronous spawning in the intertidal zone are considered, particularly with regard to hybridization/reproductive isolation in species complexes, and reproductive versus recruitment assurance in the intertidal zone, where synchronous spawning during calm periods may be important for recruitment assurance in addition to fertilization success. Ways in which the roles of spawning synchrony could be tested in closely related species with contrasting mating systems (outcrossing versus selfing) are discussed."
74,10.1098/rsbl.2010.0993,https://royalsocietypublishing.org/doi/10.1098/rsbl.2010.0993,https://royalsocietypublishing.org/doi/10.1098/rsbl.2010.0993,True,['Protect from harm'],['Protect from non-living threats'],['Protect from temperature'],['Biology Letters'],royalsocietypublishing.org,,-1,"Penguin heat-retention structures evolved in a greenhouse Earth Penguins (Sphenisciformes) inhabit some of the most extreme environments on Earth. The 60+ Myr fossil record of penguins spans an interval that witnessed dramatic shifts in Cenozoic ocean temperatures and currents, indicating a long interplay between penguin evolution and environmental change. Perhaps the most celebrated example is the successful Late Cenozoic invasion of glacial environments by crown clade penguins. A major adaptation that allows penguins to forage in cold water is the humeral arterial plexus, a vascular counter-current heat exchanger (CCHE) that limits heat loss through the flipper. Fossil evidence reveals that the humeral plexus arose at least 49 Ma during a ‘Greenhouse Earth’ interval. The evolution of the CCHE is therefore unrelated to global cooling or development of polar ice sheets, but probably represents an adaptation to foraging in subsurface waters at temperate latitudes. As global climate cooled, the CCHE was key to invasion of thermally more demanding environments associated with Antarctic ice sheets."
75,10.1038/35090573,https://www.nature.com/articles/35090573,https://www.nature.com/articles/35090573.pdf,True,['Sense send or process information'],['Sense signals/environmental cues'],['Sense light in the visible spectrum'],"['Nature', 'Journal of Materials Chemistry']",www.nature.com,,-1,"Calcitic microlenses as part of the photoreceptor system in brittlestars Photosensitivity in most echinoderms has been attributed to ‘diffuse’ dermal receptors. Here we report that certain single calcite crystals used by brittlestars for skeletal construction are also a component of specialized photosensory organs, conceivably with the function of a compound eye. The analysis of arm ossicles in Ophiocoma showed that in light-sensitive species, the periphery of the labyrinthic calcitic skeleton extends into a regular array of spherical microstructures that have a characteristic double-lens design. These structures are absent in light-indifferent species. Photolithographic experiments in which a photoresist film was illuminated through the lens array showed selective exposure of the photoresist under the lens centres. These results provide experimental evidence that the microlenses are optical elements that guide and focus the light inside the tissue. The estimated focal distance (4–7 µm below the lenses) coincides with the location of nerve bundles—the presumed primary photoreceptors. The lens array is designed to minimize spherical aberration and birefringence and to detect light from a particular direction. The optical performance is further optimized by phototropic chromatophores that regulate the dose of illumination reaching the receptors. These structures represent an example of a multifunctional biomaterial that fulfills both mechanical and optical functions."
76,10.1038/nature10325,https://www.nature.com/articles/nature10325,https://www.nature.com/articles/nature10325.pdf,True,"['Maintain ecological community', 'Chemically modify or Change energy state']","['Individual benefit', 'Change energy state']","['Regulate reproduction or growth', 'Modify/convert chemical energy']","['PNAS', 'Nature']",www.nature.com,,-1,"Hydrogen is an energy source for hydrothermal vent symbioses The discovery of deep-sea hydrothermal vents in 1977 revolutionized our understanding of the energy sources that fuel primary productivity on Earth. Hydrothermal vent ecosystems are dominated by animals that live in symbiosis with chemosynthetic bacteria. So far, only two energy sources have been shown to power chemosynthetic symbioses: reduced sulphur compounds and methane. Using metagenome sequencing, single-gene fluorescence in situ hybridization, immunohistochemistry, shipboard incubations and in situ mass spectrometry, we show here that the symbionts of the hydrothermal vent mussel Bathymodiolus from the Mid-Atlantic Ridge use hydrogen to power primary production. In addition, we show that the symbionts of Bathymodiolus mussels from Pacific vents have hupL, the key gene for hydrogen oxidation. Furthermore, the symbionts of other vent animals such as the tubeworm Riftia pachyptila and the shrimp Rimicaris exoculata also have hupL. We propose that the ability to use hydrogen as an energy source is widespread in hydrothermal vent symbioses, particularly at sites where hydrogen is abundant."
77,10.1242/jeb.38.3.659,https://jeb.biologists.org/content/38/3/659,https://journals.biologists.com/jeb/article-pdf/38/3/659/1337866/659.pdf,True,['Protect from harm'],['Protect from non-living threats'],['Protect from loss of liquids'],"['The Biology of Mangroves and Seagrasses', 'Journal of Experimental Biology (JEB)']",jeb.biologists.org,,-1,"Osmotic Regulation in the Crab-Eating Frog (Rana Cancrivora) 1. The osmotic and ionic regulatory abilities of adults of the euryhaline crab-eating frog (Rana cancrivora) have been studied. Adult frogs tolerated environmental salinities as high as 28‰ at 30°C. Tadpoles of this form tolerated salinities as high as 39%‰ at the same temperature.2. Changes in body weight of frogs following transfers to different environmental salinities indicate both that the skin of this frog is permeable to water and that these animals do not swallow large volumes of external medium, even in high salinities.3. Above salinities of about 9%‰, plasma Δ rises with increasing environmental Δ. Plasma Δ is always higher than environmental Δ. Increases in plasma concentration above fresh-water levels are due partly to increased NaCl concentration (about 40%), partly to increased urea concentration (about 60%). Urea concentrations as high as 0.48 M (2.9%) have been measured.4. Urinary Δ parallels plasma Δ, but is always lower than plasma Δ. Considerable quantities of urea are lost via the urine, even though urinary urea levels are below plasma levels.5. Measurements of short-circuit current indicate that active uptake by the skin of inorganic ions continues in R. cancrivora acclimatized to high salinities.6. R. cancrivora is no less susceptible to water loss by evaporation from the skin than are other amphibians.7. In preference experiments R. cancrivora chooses salinities below 18%‰, but shows no strong preference for a particular salinity.8. Similar observations on osmoregulatory mechanisms in a close relative of R. cancrivora, the tiger frog (R. tigerina), show that the latter species is similar to ordinary fresh-water frogs.9. The striking physiological convergence between R. cancrivora and the elasmo-branch fishes is discussed, as are various possible implications of our data regarding nitrogen metabolism in tadpoles and kidney function in adult frogs."
78,10.1242/jeb.063040,https://jeb.biologists.org/content/215/5/785,https://journals.biologists.com/jeb/article-pdf/215/5/785/1462135/785.pdf,True,['Move'],"['Passive movement', 'Active movement']","['Passively move through/on liquids', 'Actively move through/on liquids']","['Physics of Fluids', 'Philosophical Transactions of the Royal Society A', 'Bioinspiration & Biomimetics', 'Journal of Morphology', 'Journal of Experimental Biology (JEB)', 'Journal of Fish Biology']",jeb.biologists.org,,-1,"The hydrodynamic function of shark skin and two biomimetic applications SUMMARY It has long been suspected that the denticles on shark skin reduce hydrodynamic drag during locomotion, and a number of man-made materials have been produced that purport to use shark-skin-like surface roughness to reduce drag during swimming. But no studies to date have tested these claims of drag reduction under dynamic and controlled conditions in which the swimming speed and hydrodynamics of shark skin and skin-like materials can be quantitatively compared with those of controls lacking surface ornamentation or with surfaces in different orientations. We use a flapping foil robotic device that allows accurate determination of the self-propelled swimming (SPS) speed of both rigid and flexible membrane-like foils made of shark skin and two biomimetic models of shark skin to measure locomotor performance. We studied the SPS speed of real shark skin, a silicone riblet material with evenly spaced ridges and a Speedo® ‘shark skin-like’ swimsuit fabric attached to rigid flat-plate foils and when made into flexible membrane-like foils. We found no consistent increase in swimming speed with Speedo® fabric, a 7.2% increase with riblet material, whereas shark skin membranes (but not rigid shark skin plates) showed a mean 12.3% increase in swimming speed compared with the same skin foils after removing the denticles. Deformation of the shark skin membrane is thus crucial to the drag-reducing effect of surface denticles. Digital particle image velocimetry (DPIV) of the flow field surrounding moving shark skin foils shows that skin denticles promote enhanced leading-edge suction, which might have contributed to the observed increase in swimming speed. Shark skin denticles might thus enhance thrust, as well as reduce drag."
79,10.1242/jeb.068080,https://jeb.biologists.org/content/215/7/1151,https://journals.biologists.com/jeb/article-pdf/215/7/1151/1462553/1151.pdf,True,['Maintain structural integrity'],"['Manage structural forces', 'Prevent structural failure']","['Manage impact', 'Manage wear', 'Prevent fracture/rupture']",['Journal of Experimental Biology (JEB)'],jeb.biologists.org,,-1,"A buckling region in locust hindlegs contains resilin and absorbs energy when jumping or kicking goes wrong If a hindleg of a locust slips during jumping, or misses its target during kicking, energy generated by the two extensor tibiae muscles is no longer expended in raising the body or striking a target. How, then, is the energy in a jump (4100–4800 μJ) or kick (1700 μJ) dissipated? A specialised buckling region found in the proximal hind-tibia where the bending moment is high, but not present in the other legs, buckled and allowed the distal part of the tibia to extend. In jumps when a hindleg slipped, it bent by a mean of 23±14 deg at a velocity of 13.4±9.5 deg ms–1; in kicks that failed to contact a target it bent by 32±16 deg at a velocity of 32.9±9.5 deg ms–1. It also buckled 8.5±4.0 deg at a rate of 0.063±0.005 deg ms–1 when the tibia was prevented from flexing fully about the femur in preparation for both these movements. By experimentally buckling this region through 40 deg at velocities of 0.001–0.65 deg ms–1, we showed that one hindleg could store about 870 μJ on bending, of which 210 μJ was dissipated back to the leg on release. A band of blue fluorescence was revealed at the buckling region under UV illumination that had the two key signatures of the elastic protein resilin. A group of campaniform sensilla 300 μm proximal to the buckling region responded to imposed buckling movements. The features of the buckling region show that it can act as a shock absorber as proposed previously when jumping and kicking movements go wrong."
80,10.1038/nature08936,https://www.nature.com/articles/nature08936,https://www.nature.com/articles/nature08936.pdf,True,['Chemically modify or Change energy state'],['Chemically assemble'],['Self-assemble'],"['Nature', 'PNAS']",www.nature.com,,-1,"A conserved spider silk domain acts as a molecular switch that controls fibre assembly A huge variety of proteins are able to form fibrillar structures, especially at high protein concentrations. Hence, it is surprising that spider silk proteins can be stored in a soluble form at high concentrations and transformed into extremely stable fibres on demand. Silk proteins are reminiscent of amphiphilic block copolymers containing stretches of polyalanine and glycine-rich polar elements forming a repetitive core flanked by highly conserved non-repetitive amino-terminal and carboxy-terminal domains. The N-terminal domain comprises a secretion signal, but further functions remain unassigned. The C-terminal domain was implicated in the control of solubility and fibre formation initiated by changes in ionic composition and mechanical stimuli known to align the repetitive sequence elements and promote β-sheet formation. However, despite recent structural data, little is known about this remarkable behaviour in molecular detail. Here we present the solution structure of the C-terminal domain of a spider dragline silk protein and provide evidence that the structural state of this domain is essential for controlled switching between the storage and assembly forms of silk proteins. In addition, the C-terminal domain also has a role in the alignment of secondary structural features formed by the repetitive elements in the backbone of spider silk proteins, which is known to be important for the mechanical properties of the fibre."
81,10.1242/jeb.050310,https://jeb.biologists.org/content/214/13/2215.short,https://journals.biologists.com/jeb/article-pdf/214/13/2215/1436663/2215.pdf,True,['Maintain structural integrity'],['Manage structural forces'],['Manage drag/turbulence'],['Journal of Experimental Biology (JEB)'],jeb.biologists.org,,-1,"Honeybee flight: a novel ‘streamlining’ response SUMMARY Animals that move rapidly through the air can save considerable energy by reducing the drag that they need to overcome during flight. We describe a novel ‘streamlining’ response in tethered, flying honeybees in which the abdomen is held in a raised position when the visual system is exposed to a pattern of image motion that is characteristic of forward flight. This visually evoked response, which can be elicited without exposing the insect to any airflow, presumably serves to reduce the aerodynamic drag that would otherwise be produced by the abdomen during real flight. The response is critically dependent on the presence of appropriate image motion everywhere within the large field of view of the insect. Thus, our results also underscore the importance of using panoramic stimulation for the study of visually guided flight in insects, and reveal the relative importance of various regions of the visual field in assessing the speed of flight through the environment."
82,10.1371/journal.pone.0140407,https://journals.plos.org/plosone/article?id=10.1371/journal.pone.0140407,https://journals.plos.org/plosone/article/file?id=10.1371/journal.pone.0140407&type=printable,True,"['Process resources', 'Move']","['Distribute resources', 'Passive movement']","['Distribute solids', 'Passively move through gases']","['Mycologia', 'PLOS One']",journals.plos.org,,-1,"Mushrooms as Rainmakers: How Spores Act as Nuclei for Raindrops Millions of tons of fungal spores are dispersed in the atmosphere every year. These living cells, along with plant spores and pollen grains, may act as nuclei for condensation of water in clouds. Basidiospores released by mushrooms form a significant proportion of these aerosols, particularly above tropical forests. Mushroom spores are discharged from gills by the rapid displacement of a droplet of fluid on the cell surface. This droplet is formed by the condensation of water on the spore surface stimulated by the secretion of mannitol and other hygroscopic sugars. This fluid is carried with the spore during discharge, but evaporates once the spore is airborne. Using environmental electron microscopy, we have demonstrated that droplets reform on spores in humid air. The kinetics of this process suggest that basidiospores are especially effective as nuclei for the formation of large water drops in clouds. Through this mechanism, mushroom spores may promote rainfall in ecosystems that support large populations of ectomycorrhizal and saprotrophic basidiomycetes. Our research heightens interest in the global significance of the fungi and raises additional concerns about the sustainability of forests that depend on heavy precipitation."
83,10.1098/rspb.2012.0558,https://royalsocietypublishing.org/doi/10.1098/rspb.2012.0558,https://royalsocietypublishing.org/doi/10.1098/rspb.2012.0558,True,['Protect from harm'],['Protect from non-living threats'],['Protect from gases'],"['American Journal of Physiology', 'Proceedings of the Royal Society B']",royalsocietypublishing.org,,-1,"Dermal bone in early tetrapods: a palaeophysiological hypothesis of adaptation for terrestrial acidosis The dermal bone sculpture of early, basal tetrapods of the Permo-Carboniferous is unlike the bone surface of any living vertebrate, and its function has long been obscure. Drawing from physiological studies of extant tetrapods, where dermal bone or other calcified tissues aid in regulating acid–base balance relating to hypercapnia (excess blood carbon dioxide) and/or lactate acidosis, we propose a similar function for these sculptured dermal bones in early tetrapods. Unlike the condition in modern reptiles, which experience hypercapnia when submerged in water, these animals would have experienced hypercapnia on land, owing to likely inefficient means of eliminating carbon dioxide. The different patterns of dermal bone sculpture in these tetrapods largely correlates with levels of terrestriality: sculpture is reduced or lost in stem amniotes that likely had the more efficient lung ventilation mode of costal aspiration, and in small-sized stem amphibians that would have been able to use the skin for gas exchange."
84,10.1242/jeb.062620,https://jeb.biologists.org/content/214/23/3960,https://journals.biologists.com/jeb/article-pdf/214/23/3960/1276925/3960.pdf,True,['Change size or color'],['Modify color'],"['Change chemical color/pigmentation', 'Change structural color']",['Journal of Experimental Biology (JEB)'],jeb.biologists.org,,-1,"Kingfisher feathers – colouration by pigments, spongy nanostructures and thin films SUMMARY The colours of the common kingfisher, Alcedo atthis, reside in the barbs of the three main types of feather: the orange breast feathers, the cyan back feathers and the blue tail feathers. Scanning electron microscopy showed that the orange barbs contain small pigment granules. The cyan and blue barbs contain spongy nanostructures with slightly different dimensions, causing different reflectance spectra. Imaging scatterometry showed that the pigmented barbs create a diffuse orange scattering and the spongy barb structures create iridescence. The extent of the angle-dependent light scattering increases with decreasing wavelength. All barbs have a cortical envelope with a thickness of a few micrometres. The reflectance spectra of the cortex of the barbs show oscillations when measured from small areas, but when measured from larger areas the spectra become wavelength independent. This can be directly understood with thin film modelling, assuming a somewhat variable cortex thickness. The cortex reflectance appears to be small but not negligible with respect to the pigmentary and structural barb reflectance."
85,10.1242/jeb.101931,https://jeb.biologists.org/content/217/12/2193,https://journals.biologists.com/jeb/article-pdf/217/12/2193/1880649/2193.pdf,True,['Protect from harm'],['Protect from non-living threats'],"['Protect from ice', 'Protect from temperature']","['Comparative Biochemistry and Physiology Part A: Physiology', 'Journal of Experimental Biology (JEB)', 'Annual Review of Ecology and Systematics']",jeb.biologists.org,,-1,"Wood frog adaptations to overwintering in Alaska: new limits to freezing tolerance We investigated the ecological physiology and behavior of free-living wood frogs [Lithobates (Rana) sylvaticus] overwintering in Interior Alaska by tracking animals into natural hibernacula, recording microclimate, and determining frog survival in spring. We measured cryoprotectant (glucose) concentrations and identified the presence of antifreeze glycolipids in tissues from subsamples of naturally freezing frogs. We also recorded the behavior of wood frogs preparing to freeze in artificial hibernacula, and tissue glucose concentrations in captive wood frogs frozen in the laboratory to −2.5°C. Wood frogs in natural hibernacula remained frozen for 193±11 consecutive days and experienced average (October–May) temperatures of −6.3°C and average minimum temperatures of −14.6±2.8°C (range −8.9 to −18.1°C) with 100% survival (N=18). Mean glucose concentrations were 13-fold higher in muscle, 10-fold higher in heart and 3.3-fold higher in liver in naturally freezing compared with laboratory frozen frogs. Antifreeze glycolipid was present in extracts from muscle and internal organs, but not skin, of frozen frogs. Wood frogs in Interior Alaska survive freezing to extreme limits and durations compared with those described in animals collected in southern Canada or the Midwestern United States. We hypothesize that this enhancement of freeze tolerance in Alaskan wood frogs is due to higher cryoprotectant levels that are produced by repeated freezing and thawing cycles experienced under natural conditions during early autumn."
